ID,Scholarship Title,Provider,Scholarship Type,Provider Sub Type,State,Residency Requirement,Course Stream,Age Limit,Total Awards,Community,Gender,Education Level,Minimum Marks,Income Limit,Minimum Scholarship Amount,Annual Amount,Amount Description,Deadline,Deadline Description,Official Website,SEO Keywords,Special conditions,Tags,Thumbnail URL,Documents Needed,Apply URL,Introduction,Benefits,Application Step by Step Guide,Selection Process,FAQs,Verified,Last Verified Date,Verification year,Application Type,Show on Homepage,Is Featured,Is Popular,Priority Score,Scholarship Status,Time to apply (mins),Renewal,Helpline,Competitiveness,Internal Notes,Production Status
sc_corp_bharti_001,Bharti Airtel Scholarship Program 2025-2026,Bharti Foundation,Corporate,Corporate,All India,Indian citizens and residents,"Electronics & Communication, Telecom, IT, Computer Sciences, Data Sciences, Aerospace, AI, IoT, AR/VR, Machine Learning, Robotics",First year students only (2025-2026 academic year),"276 (2024-25), Target: 250-300 annually",All,"All (Preference to girls, persons with disabilities, single/no parents, transgender)",UG,Admission to top 50 NIRF-ranked engineering universities (NIRF 2024),850000,50000,"Varies (100% tuition fees - typically ₹1,00,000-₹3,00,000/year)","100% tuition fees + 100% hostel and mess fees + New laptop in first year. Covers entire course duration (4-5 years)",2025-07-31,"July 31, 2025 - Apply early as selection is competitive",https://www.bhartifoundation.org,"bharti airtel scholarship, airtel foundation scholarship, engineering scholarship india, top 50 nirf scholarship, corporate scholarship","Must be in top 50 NIRF-ranked institutions. Preference to underrepresented groups. Cannot receive other scholarships for same purpose","corporate, engineering, technology, nirf, laptop grant, mentorship",,"Aadhaar/PAN/Driving License, Admission Proof, Class 12 Marksheet, JEE/University Entrance Scorecard, Family Income Proof, Bank Account Details (Aadhaar-linked), Institution Bank Details, Passport Photo, Statement of Purpose, Hostel/PG Rent Receipts (if applicable)",https://www.buddy4study.com,"Bharti Airtel Scholarship 2025-2026 provides 100% tuition fees, hostel charges, and a free laptop for meritorious engineering students in India's top 50 NIRF-ranked institutions. Apply by July 31, 2025 with family income below ₹8.5 lakh.","100% annual tuition fees for entire course duration (4-5 years), 100% hostel and mess fees, New laptop in first year, Mentorship and career guidance, Renewable annually","1. Visit Buddy4Study website 2. Click 'Apply Now' for Bharti Airtel Scholarship 3. Login or register 4. Fill application form with personal and academic details 5. Upload all required documents (Aadhaar, admission proof, Class 12 marksheet, entrance exam scorecard, income proof, bank details, SOP) 6. Submit application before July 31, 2025 7. Track application status online","Merit-cum-means based selection. Preference given to female candidates, persons with disabilities, students with single/no parents, and transgender individuals. Must maintain minimum CGPA 6.0 and 75% attendance for renewal","Q: Who is eligible? A: First-year engineering students in top 50 NIRF-ranked institutions with family income below ₹8.5 lakh. Q: Is it renewable? A: Yes, renewable for entire course duration (4-5 years) with minimum CGPA 6.0 and 75% attendance. Q: What is covered? A: 100% tuition fees, hostel/mess fees, and a laptop in first year. Q: Can I apply if I'm in a private institution? A: Yes, if it's in top 50 NIRF rankings.",Verified,2026-01-02,2026,Online,TRUE,TRUE,TRUE,85,Active,45,"Yes, renewable for entire course duration (4-5 years) subject to maintaining CGPA 6.0 and 75% attendance",Managed through Buddy4Study platform. Check Buddy4Study website for helpline,High,"Launched in 2024. 276 scholars selected in 2024-25 (22% girls). Long-term goal: 4,000 scholars/year. Application via Buddy4Study platform.",Ready for Production
sc_corp_jindal_001,Sitaram Jindal Foundation Scholarship 2026,Sitaram Jindal Foundation,Corporate,Corporate,All India,Indian nationals,"All streams (General, Medical, Engineering, ITI, Diploma)",Generally not above 30 years,"12,000 students supported (cumulative)",All,All (Lower marks requirement for girls),"Class 11-12, ITI, Diploma, UG, PG","Class 11-12: 60% boys/55% girls (General), 70% boys/65% girls (Karnataka). UG Engineering/Medicine: 65% boys/60% girls. PG: 60% boys/55% girls","400000 (salaried), 250000 (others)",10000,"Varies by level (₹10,000-₹50,000 estimated)","Merit-cum-means based scholarship. Amount varies by course level and category. Specific amounts not publicly disclosed",Typically September-October,"Application period usually opens in August-September. Check official website for exact dates",https://www.sitaramjindalfoundation.org,"jindal scholarship, sitaram jindal foundation, merit scholarship india, engineering scholarship, medical scholarship","For government, government-aided, and affordable private institutions. Income certificate should not be more than 2 years old. Cannot receive other scholarships","corporate, merit-cum-means, class 11-pg, state-specific marks, renewal available",,"Academic certificates (Class 7-8 marksheets for Class 11, previous qualifying exam marksheets), Income Certificate (not more than 2 years old), School/College Bonafide Certificate, Bank Account details, Aadhaar, Residential proof",https://www.sitaramjindalfoundation.org,"Sitaram Jindal Foundation Scholarship 2026 supports meritorious students from Class 11 to postgraduate levels with merit-cum-means based financial aid. Apply with family income below ₹4 lakh (salaried) or ₹2.5 lakh (others).","Financial assistance for tuition and educational expenses. Renewable annually with 5% relaxation in marks for renewal applicants. Supports students in government, government-aided, and affordable private institutions","1. Visit Sitaram Jindal Foundation official website 2. Check eligibility criteria for your state and course level 3. Register on the scholarship portal 4. Fill application form with personal, academic, and family details 5. Upload required documents (marksheets, income certificate, bonafide, bank details, Aadhaar) 6. Submit application before deadline 7. Track application status","Merit-cum-means based selection. State-specific and gender-specific mark requirements. Preference to students in government and government-aided institutions. Verification by foundation authorities","Q: Who is eligible? A: Students from Class 11 to PG with required marks and family income below limits. Q: Are marks requirements different for girls? A: Yes, girls have 5% lower marks requirement. Q: Is it renewable? A: Yes, renewable annually with 5% relaxation in marks. Q: What is the income limit? A: ₹4 lakh for salaried, ₹2.5 lakh for others.",Verified,2026-01-02,2026,Online,TRUE,TRUE,TRUE,80,Active,35,"Yes, renewable annually with 5% relaxation in marks for renewal applicants","Email: scholarship@sitaramjindalfoundation.org, Phone: +91-80-2371-7777/78/79/80, Address: Jindal Nagar, Tumkur Road, Bengaluru 560073",Medium,"Supported almost 12,000 students cumulatively. Also aids 500+ charitable institutions and provides vocational training to 400 girls annually. State-specific mark requirements.",Ready for Production
sc_corp_hdfc_001,HDFC Bank Parivartan's Educational Crisis Scholarship Support (ECSS) Programme 2026-27,HDFC Bank (Parivartan),Corporate,Corporate,All India,Indian nationals,All streams,No specific age limit (Class 1 to PG students),Not publicly disclosed (varies annually),All,All,"Class 1-12, Diploma, ITI, Polytechnic, UG, PG",55% in previous qualifying examination,250000,15000,"Class 1-6: ₹15,000, Class 7-12/Diploma/ITI: ₹18,000, General UG: ₹30,000, Professional UG: ₹50,000, General PG: ₹35,000, Professional PG: ₹75,000","Scholarship amount varies by education level from ₹15,000 to ₹75,000. Covers tuition, books, and living expenses",Typically announced annually,Application period announced annually. Check official website for current year deadline,https://parivartanecss.com,"hdfc scholarship, parivartan ecss, crisis scholarship, educational support, hdfc bank scholarship","Preference to students who faced personal/family crisis in last 3 years. Proof of crisis required if applicable","corporate, crisis support, class 1-pg, need-based, all streams",,"Passport-size photograph, Previous year marksheets, Identity proof (Aadhaar/Voter ID/Driving License), Current year admission proof, Income proof (from Gram Panchayat/Ward Counsellor/Sarpanch/SDM/DM/CO/Tehsildar or affidavit), Bank passbook or cancelled cheque, Proof of personal/family crisis (if applicable - death certificate, job loss letter, medical report)",https://parivartanecss.com,"HDFC Bank Parivartan ECSS Scholarship 2026-27 provides ₹15,000 to ₹75,000 for meritorious and financially vulnerable students from Class 1 to postgraduate levels. Preference to students facing personal or family crises. Apply with 55% marks and family income below ₹2.5 lakh.","Financial aid from ₹15,000 to ₹75,000 based on education level. Covers tuition fees, books, and living expenses. Helps students at risk of dropping out due to financial crises","1. Visit parivartanecss.com or Buddy4Study website 2. Click 'Apply Now' 3. Login or register 4. Navigate to Parivartan ECSS Scholarship 2025-26 application form 5. Click 'Start Application' 6. Fill all required details (personal, academic, family income, crisis details if applicable) 7. Upload documents (photo, marksheets, ID proof, admission proof, income proof, bank details, crisis proof if applicable) 8. Accept Terms and Conditions 9. Preview and verify details 10. Submit application","Merit-cum-need based selection with 55% minimum marks. Preference given to students who have faced significant personal or family crisis within last 3 years impacting their education","Q: Who is eligible? A: Students from Class 1 to PG with 55%+ marks and family income below ₹2.5 lakh. Q: What is the scholarship amount? A: ₹15,000 to ₹75,000 depending on education level. Q: Is crisis proof mandatory? A: No, but preference is given to crisis-affected students. Q: What crises are considered? A: Death in family, job loss, medical emergencies, natural disasters, etc.",Verified,2026-01-02,2026,Online,TRUE,TRUE,TRUE,75,Active,30,Not specified (typically one-time or annual reapplication required),Check Buddy4Study website or parivartanecss.com for helpline contact,Medium,Focus on crisis-affected students. Wide coverage from Class 1 to PG. Application via Buddy4Study or official portal.,Ready for Production
sc_corp_reliance_001,Reliance Foundation Undergraduate Scholarship Programme 2025-26,Reliance Foundation,Corporate,Corporate,All India,Indian citizens (resident),All streams,First year UG students only,"5,000 annually (UG). Commitment: 50,000 scholarships over 10 years",All,All,UG,60% in Class 12,"1500000 (preference to below ₹2,50,000)",50000,"Up to ₹2,00,000 total over entire degree duration (approx ₹50,000-₹66,000/year)","Up to ₹2,00,000 over entire degree duration. Covers tuition fees and academic expenses",2025-10-07,"October 7, 2025 (extended deadline for 2025-26). Applications start September 15, 2025",https://www.reliancefoundation.org,"reliance foundation scholarship, reliance scholarship, undergraduate scholarship india, corporate scholarship, aptitude test scholarship","Must pass mandatory aptitude test. Regular full-time degree only (not online/hybrid/remote). Preference to income below ₹2.5 lakh","corporate, aptitude test, mentorship, networking, skill-building, leadership",,"Passport-size photograph, Proof of address (permanent), Class 10 and Class 12 marksheets, Bonafide Student Certificate, Family Income Proof (from Gram Panchayat/Ward Counsellor/Sarpanch/SDM/DM/CO/Tehsildar), Official Disability Certificate (if applicable), PAN and Bank details",https://www.scholarships.reliancefoundation.org,"Reliance Foundation Undergraduate Scholarship 2025-26 provides up to ₹2,00,000 for first-year UG students with 60% in Class 12 and family income below ₹15 lakh. Includes aptitude test, mentorship, networking, and skill-building opportunities. Apply by October 7, 2025.","Up to ₹2,00,000 over degree duration, Networking opportunities through strong alumni network, Mentorship programs, Skill-building sessions, Leadership development programs, Renewable for course duration","1. Visit www.scholarships.reliancefoundation.org 2. Complete eligibility questionnaire 3. If eligible, receive email invitation with login details 4. Login to application portal 5. Fill application form with personal, academic, and family details 6. Upload required documents (photo, address proof, Class 10-12 marksheets, bonafide certificate, income proof, PAN, bank details) 7. Submit application before October 7, 2025 8. Appear for mandatory aptitude test (schedule shared after registration) 9. Track application status","Merit-cum-means based. Mandatory aptitude test required. Preference to students with family income below ₹2.5 lakh. Must be enrolled in regular full-time degree program","Q: Who is eligible? A: First-year UG students with 60% in Class 12 and family income below ₹15 lakh. Q: Is aptitude test mandatory? A: Yes, all applicants must pass the aptitude test. Q: Is it renewable? A: Yes, renewable for entire course duration. Q: Can online/hybrid students apply? A: No, only regular full-time degree students are eligible.",Verified,2026-01-02,2026,Online,TRUE,TRUE,TRUE,85,Active,40,"Yes, renewable for entire course duration","WhatsApp: 7977 100 100 (text ""hi""), Phone: (011) 4117 1414, Email: RF.UGScholarships@reliancefoundation.org",High,"5,000 UG scholars selected annually. Commitment to 50,000 scholarships over 10 years (2022-2032). Strong focus on networking and mentorship.",Ready for Production
sc_corp_infosys_001,Infosys Foundation STEM Stars Scholarship Program 2026,Infosys Foundation,Corporate,Corporate,All India,Indian citizens,"B.E./B.Tech (Engineering), B.Sc (Science), STEM fields",First year UG STEM students (also 2nd year of 5-year B.Arch),Not publicly disclosed (Foundation allocated ₹100+ crore),All,Female only,UG,Strong performance in Class 12 (especially PCM),800000,100000,100000,"Up to ₹1,00,000 per year for entire course duration. Covers tuition fees, study materials, and living expenses",Typically announced annually,Application period announced annually. Check Infosys Foundation website for exact dates,https://www.infosys.com/infosys-foundation,"infosys scholarship, stem scholarship women, female engineering scholarship, infosys foundation, women in technology","Female candidates only. NIRF-accredited or government-recognized engineering colleges. Should not be receiving other scholarships for same expenses. Government-issued Income Certificate required","corporate, female only, stem, engineering, women empowerment, technology",,"Recent passport-sized photograph, Class 12 marksheet and passing certificate, JEE Main/CET/NEET scorecard, Government-issued ID (Aadhaar/Voter ID/Passport/Ration Card), Proof of current year admission (fee receipt/admission letter/institution ID/bonafide certificate), Family income proof certificate (government-issued), BPL card or Ayushman Bharat card (if applicable), Electricity bills for past 6 months, Bank account details (passbook/cancelled cheque), Receipts of academic expenses (course fees, hostel, mess, stationery, books)",https://www.infosys.com/infosys-foundation,"Infosys Foundation STEM Stars Scholarship 2026 provides up to ₹1,00,000 per year for female Indian students pursuing undergraduate STEM degrees. Covers tuition, study materials, and living expenses for entire course duration. Apply with family income below ₹8 lakh.","Up to ₹1,00,000 per year for entire course duration, Covers tuition fees, study materials, and living expenses, Empowers women in STEM fields, Renewable annually","1. Visit Infosys Foundation official website 2. Navigate to STEM Stars Scholarship section 3. Check eligibility criteria 4. Register for scholarship application 5. Fill application form with personal, academic, and family details 6. Upload all required documents (photo, Class 12 marksheet, entrance exam scorecard, ID proof, admission proof, income certificate, electricity bills, bank details, expense receipts) 7. Submit application before deadline 8. Track application status","Merit-based selection for female STEM students. Focus on strong academic performance in Class 12 (especially PCM). Must be enrolled in NIRF-accredited or government-recognized engineering colleges. Income below ₹8 lakh required","Q: Who is eligible? A: Female Indian citizens pursuing first-year UG STEM courses with family income below ₹8 lakh. Q: What is covered? A: Up to ₹1,00,000/year for tuition, study materials, and living expenses. Q: Can I apply if I'm in 2nd year? A: Yes, if you're in 2nd year of 5-year B.Arch or 5-year Integrated/Dual Degree STEM program. Q: Is it renewable? A: Yes, renewable for entire course duration.",Verified,2026-01-02,2026,Online,TRUE,TRUE,TRUE,80,Active,35,"Yes, renewable for entire course duration","Email: infosysstemstars@buddy4study.com, Phone: 011-430-92248 (Ext-351), Available: Monday-Friday, 10:00 AM - 06:00 PM (IST)",High,Exclusively for female students. Foundation allocated ₹100+ crore. Focus on empowering women in STEM. Application may be via Buddy4Study.,Ready for Production
